{
  "processo_id": "0801234-56.2024.8.10.0001",
  "ifp": {
    "score": 100,
    "tier": "FORTE",
    "versao": "v2",
    "componentes": {
      "presenca": 60,
      "qualidade": 40
    }
  },
  "subsidios": {
    "contrato": {
      "presente": true,
      "peso_aplicado": 13,
      "features": {
        "numero_contrato": "502348719",
        "nome_tomador": "MARIA DAS GRAÇAS SILVA PEREIRA",
        "cpf_tomador": "456.789.123-45",
        "valor_liberado": 5000.0,
        "valor_total_pago": 8640.0,
        "parcela": 120.0,
        "qtd_parcelas": 72,
        "taxa_juros_am": 1.87,
        "cet_aa": 28.41,
        "data_emissao": "2022-05-10",
        "canal_contratacao": "correspondente",
        "assinatura_tomador_presente": true
      }
    },
    "extrato": {
      "presente": true,
      "peso_aplicado": 13,
      "features": {
        "credito_emprestimo_aparece": true,
        "valor_credito": 5000.0,
        "autor_movimentou_dinheiro": true,
        "tipos_movimentacao": [
          "TED",
          "TRANSFERÊNCIA PIX",
          "SAQUE"
        ],
        "valor_total_movimentado": 4985.0,
        "destinatarios_suspeitos": false
      }
    },
    "comprovante": {
      "presente": true,
      "peso_aplicado": 9,
      "features": {
        "numero_contrato": "502348719",
        "cpf_tomador": "456.789.123-45",
        "valor_operacao": 5000.0,
        "qtd_parcelas": 72,
        "taxa_juros_am": 1.87,
        "cet_aa": 28.41,
        "data_contratacao": "2022-05-10",
        "canal_contratacao": "telefonico",
        "forma_liberacao": "credito_conta_corrente",
        "instituicao_depositaria": "Banco UFMG S.A."
      }
    },
    "demonstrativo": {
      "presente": true,
      "peso_aplicado": 7,
      "features": {
        "numero_contrato": "502348719",
        "valor_financiado": 5000.0,
        "qtd_parcelas_total": 72,
        "qtd_parcelas_pagas": 21,
        "qtd_parcelas_em_aberto": 51,
        "data_primeira_parcela": "2022-06-10",
        "data_primeira_inadimplencia": "2024-03-10"
      }
    },
    "dossie": {
      "presente": true,
      "peso_aplicado": 9,
      "features": {
        "assinatura_confere": true,
        "rg_confere": true,
        "liveness_aprovada": true,
        "comprovante_residencia_valido": true,
        "score_confianca": 91.0,
        "conclusao_geral": "conformidade"
      }
    },
    "laudo": {
      "presente": true,
      "peso_aplicado": 9,
      "features": {
        "numero_contrato": "502348719",
        "canal_contratacao": "correspondente",
        "situacao_atual": "ATIVO",
        "tem_gravacao_voz": true,
        "tem_biometria_facial": false,
        "tem_device_fingerprint": false,
        "tem_geolocalizacao": false,
        "tem_ip_registrado": false,
        "tem_assinatura_manuscrita": true,
        "correspondente_bancario": "Credi Fácil Serviços Financeiros Ltda."
      }
    }
  },
  "sinais_fortes": [
    "extrato_autor_movimentou_dinheiro",
    "demonstrativo_21_parcelas_pagas",
    "dossie_assinatura_confere",
    "laudo_evidencia_digital(gravacao_voz)"
  ],
  "sinais_ausentes": [],
  "reasoning_curto": "IFP v2 = 100 (FORTE). Todos os 6 subsídios presentes; qualidade 40/40."
}